{
  "$schema": "https://json-schema.org/draft/2020-12/schema",
  "$id": "https://agentic-framework.github.com/schemas/v1alpha1/domain-packs/business-operations/controls-approvals.schema.json",
  "type": "object", "additionalProperties": false,
  "required": ["schemaVersion", "artifactType", "proposalOnly", "sourceDigests", "upstreamArtifactDigests", "data"],
  "properties": {
    "schemaVersion": { "const": "1.0.0" }, "artifactType": { "const": "controls-approvals" }, "proposalOnly": { "const": true },
    "sourceDigests": { "$ref": "#/$defs/digests" }, "upstreamArtifactDigests": { "$ref": "#/$defs/digests" },
    "data": { "type": "object", "additionalProperties": false, "required": ["controls", "quorum"], "properties": {
      "controls": { "type": "array", "minItems": 1, "items": { "type": "object", "additionalProperties": false, "required": ["controlId", "ownerRole", "operatorRole", "verifierRole", "policyRole", "evidence"], "properties": {
        "controlId": { "type": "string", "pattern": "^control:[a-z0-9-]+$" }, "ownerRole": { "const": "role:control-owner" }, "operatorRole": { "const": "role:implementer" }, "verifierRole": { "const": "role:verifier" }, "policyRole": { "const": "role:policy-authority" }, "evidence": { "type": "string", "minLength": 1 }
      } } },
      "quorum": { "const": 4 }
    } }
  },
  "$defs": { "digests": { "type": "array", "minItems": 1, "uniqueItems": true, "items": { "type": "string", "pattern": "^sha256:[a-f0-9]{64}$" } } }
}
