{"schemaVersion":"1.0.0","artifactType":"controls-approvals","proposalOnly":true,"sourceDigests":["sha256:aaaaaaaaaaaaaaaaaaaaaaaaaaaaaaaaaaaaaaaaaaaaaaaaaaaaaaaaaaaaaaaa"],"upstreamArtifactDigests":["sha256:bbbbbbbbbbbbbbbbbbbbbbbbbbbbbbbbbbbbbbbbbbbbbbbbbbbbbbbbbbbbbbbb"],"data":{"controls":[{"controlId":"control:independent-review","ownerRole":"role:control-owner","operatorRole":"role:implementer","verifierRole":"role:verifier","policyRole":"role:policy-authority","evidence":"Signed current artifact review evidence."}],"quorum":4}}
